{
  "version": "1",
  "initiative": "",
  "run_id": "",
  "created_at": "",
  "updated_at": "",
  "branch": null,
  "commit": null,
  "artifact_root": "",
  "next_action": "",
  "state": "UPSTREAM_INTAKE",
  "upstream_source": "",
  "upstream_approval_status": "PENDING",
  "upstream_approved_by": null,
  "upstream_approved_at": null,
  "base_branch": null,
  "base_commit": null,
  "implementation_head": null,
  "plan_status": null,
  "routed_roles": [],
  "temperament": null,
  "adversarial_pair": false,
  "stop_after": null,
  "post_hoc_review": false,
  "final_decision": null,
  "open_blockers": [],
  "required_conditions": []
}
