{
  "version": "1",
  "initiative": "cross-repo-rollup",
  "run_id": "20260717T033357818644Z-0c9b96b7-cross-repo-rollup",
  "created_at": "2026-07-17T03:33:57.818644+00:00",
  "updated_at": "2026-08-03T23:18:23+00:00",
  "branch": "ci/windows-runtime-verification",
  "commit": "a266460cc822449a22e3d3486d926fc3cd6820ea",
  "artifact_root": ".eng-level/runs/20260717T033357818644Z-0c9b96b7-cross-repo-rollup",
  "next_action": "create or revise engineering plan",
  "state": "PLAN_REQUIRED",
  "upstream_source": "execforge MODIFY decision (this session, 2026-07-17): Citadel KILL, redirect to read-only cross-repo roll-up",
  "upstream_approval_status": "APPROVED",
  "upstream_approved_by": "operator (v3x5exia555)",
  "upstream_approved_at": "2026-08-03T23:18:23+00:00",
  "base_branch": null,
  "base_commit": null,
  "implementation_head": null,
  "plan_status": null,
  "routed_roles": ["architect", "manager"],
  "temperament": null,
  "adversarial_pair": false,
  "stop_after": "plan",
  "post_hoc_review": false,
  "final_decision": null,
  "open_blockers": [],
  "required_conditions": []
}
